{
  "checkedAt": "2026-04-12T12:10:00Z",
  "projectIdentifier": "examples/pong-testbed",
  "singleTargetReady": true,
  "launchControlAvailable": true,
  "runtimeBridgeAvailable": true,
  "captureControlAvailable": true,
  "persistenceAvailable": true,
  "validationAvailable": true,
  "shutdownControlAvailable": true,
  "blockedReasons": [],
  "recommendedControlPath": "file_broker",
  "notes": [
    "The example project is ready for autonomous editor evidence runs."
  ]
}
